{
  "package_schema_version": 1,
  "package_type": "minigame-research",
  "package_id": "research-minigame-tithe-farm",
  "activity": "Tithe Farm",
  "status": "research-proposal",
  "checked_at": "2026-08-22",
  "scope": "Current factual research package for the members-only, solo Farming activity in Hosidius. It proposes normalization records only. It does not select a route, point target, seed tier, planting pattern, or account outcome.",
  "facts_strategy_boundary": {
    "included": [
      "current entry and travel facts, Farming gates, seed tiers, local tools, crop lifecycle, session persistence, exact point and experience rules, current shop stock, and current point cap",
      "deterministic point-shop purchases versus variable shop-container contents, pet rolls, player execution, and crop survival",
      "factual alternatives for seed dibbers, watering cans, free fertiliser, and the permanent Gricoller's can",
      "proposed observed account state for sessions, crops, fruit, points, shop purchases, tool water, and Farming experience"
    ],
    "excluded": [
      "whether Tithe Farm should be rushed, which reward should be bought first, whether to pursue the collection log, or any recommended stop point",
      "an assumed successful run, crop survival, number of plants, deposited fruit, points, shop purchase, XP award, pet roll, water supply, boost, or account readiness",
      "execution-dependent rates, time-to-reward estimates, input availability, attention tolerance, or a recommended planting route",
      "community planting patterns and guide advice except where explicitly labeled strategy-candidate-not-fact"
    ]
  },
  "source_catalog": [
    {
      "id": "wiki-tithe-farm-current",
      "publisher": "Old School RuneScape Wiki",
      "kind": "wiki",
      "url": "https://oldschool.runescape.wiki/w/Tithe_Farm",
      "checked_at": "2026-08-22",
      "use": "Current access, Hosidius transport options, solo-instance status, seed tiers, boosts, local loop, watering and crop failure, logout and exit state, fruit/point/XP thresholds, point cap, and dated updates. Revalidates existing source id wiki-tithe-farm."
    },
    {
      "id": "wiki-farmer-gricollers-rewards-current",
      "publisher": "Old School RuneScape Wiki",
      "kind": "wiki",
      "url": "https://oldschool.runescape.wiki/w/Farmer_Gricoller%27s_Rewards",
      "checked_at": "2026-08-22",
      "use": "Complete current reward-shop stock, exact costs, Farmer's outfit exchange value, deterministic purchases, Bologa's blessing bundle, Herb box and Seed pack variability, and collection-log boundary. Revalidates existing source id wiki-tithe-rewards."
    },
    {
      "id": "wiki-tithe-farm-strategies-current",
      "publisher": "Old School RuneScape Wiki community guide",
      "kind": "guide",
      "url": "https://oldschool.runescape.wiki/w/Tithe_Farm/Strategies",
      "checked_at": "2026-08-22",
      "use": "Clearly separated community strategy material for basic, fertiliser, combo, and 25x4 patterns, tool alternatives, and active-attention characteristics. It is not used as an account-rate guarantee."
    },
    {
      "id": "steamdb-poll-85-tithe-farm-cap-archive",
      "publisher": "SteamDB reproducing Old School RuneScape update notes",
      "kind": "other",
      "url": "https://steamdb.info/patchnotes/19872724/",
      "checked_at": "2026-08-22",
      "use": "Dated archive of the September 2025 Old School RuneScape update notes that explicitly raises the cap from 1,000 to 16,000. The current Wiki activity page independently supplies the current cap and related history."
    },
    {
      "id": "runenation-poll-83-tithe-seed-pack-reference",
      "publisher": "RuneNation reproducing Old School RuneScape poll material",
      "kind": "guide",
      "url": "https://www.runenation.org/news-and-updates/osrs-news-and-updates/11210-poll-83-castle-wars-new-player-changes-more",
      "checked_at": "2026-08-22",
      "use": "Clearly labeled community reproduction of the poll material describing the 2025 Tithe Farm reward-shop Seed pack addition. Current shop mechanics are rechecked against the current Wiki reward page."
    },
    {
      "id": "github-runelite-tithe-farm-plugin",
      "publisher": "RuneLite",
      "kind": "github",
      "url": "https://github.com/runelite/runelite/tree/master/runelite-client/src/main/java/net/runelite/client/plugins/tithefarm",
      "checked_at": "2026-08-22",
      "use": "External implementation evidence that crop timers are displayable observations. It is not a mechanics authority and must not turn timers into inferred crop survival or output."
    },
    {
      "id": "guide-bruhsailer-tithe-farm-2026",
      "publisher": "BRUHsailer",
      "kind": "guide",
      "url": "https://osrsper.github.io/BRUHsailer/",
      "checked_at": "2026-08-22",
      "use": "Current Ironman-guide example of boosted Bologano and 25x4 advice. Retained only as a labeled strategy candidate, never as an account-state or timing fact."
    },
    {
      "id": "reddit-ironscape-tithe-farm-patterns-2026",
      "publisher": "r/ironscape",
      "kind": "reddit",
      "url": "https://www.reddit.com/r/ironscape/comments/1uxqfls/i_like_the_tithe_farm/",
      "checked_at": "2026-08-22",
      "use": "Player discussion of 20, 21, 24, and 25-plant patterns and subjective attention burden. Used only as strategy-candidate evidence."
    },
    {
      "id": "youtube-dehsow-tithe-farm-25x4-2026",
      "publisher": "Dehsow",
      "kind": "youtube",
      "url": "https://www.youtube.com/watch?v=gnkGUlIuHoE",
      "checked_at": "2026-08-22",
      "use": "Current video example of a 25x4 tile pattern. Used only as a labeled execution strategy candidate."
    }
  ],
  "access": {
    "requirements": {
      "membership": true,
      "minigame_gate": {
        "skill": "Farming",
        "level": 34,
        "boostability": "A boost may be used to take and plant a seed tier. The qualifying boosted Farming level must remain present for both retrieval and planting; after planting, watering and harvesting do not require the boost. Do not infer a boost, its duration, or eligibility from a plan."
      },
      "quest_prerequisites": [],
      "removed_historical_gate": "Hosidius favour is not a current access requirement. The level-34 access state followed the removal of Kourend favour in 2024.",
      "base_entry_fee": {"coins": 0, "consumable_ticket": null},
      "required_tools": [
        "spade",
        "seed dibber, unless the Farming portion of Barbarian Training has been completed for bare-handed planting",
        "one or more watering cans with usable water doses, or an observed Gricoller's can with usable water doses"
      ],
      "reference_existing_production_facts": [
        "utility-tithe-farm-access-and-currency",
        "utility-tithe-farm-durable-rewards",
        "utility-stop-tithe-farm"
      ],
      "reference_existing_action": "action:tithe-farm"
    },
    "location_and_transport": [
      "The activity is south-east of Hosidius in Great Kourend. It is an instanced, solo-only activity; entering does not establish a successful session or output.",
      "The Grouping interface minigame teleport can target Tithe Farm only after the player has entered Tithe Farm at least once; first-entry history remains an observed account flag.",
      "Lovakengj Minecart Network to Hosidius South places the player directly south of the activity, subject to its independent network access and destination unlock state.",
      "Fairy ring AKR to Hosidius Vinery, a Hosidius teleport or a POH exit in Hosidius, Xeric's Glade, Kharedst's memoirs or Book of the dead Hosidius reminisce, Skills necklace to Woodcutting Guild, and Kourend Castle Teleport are separate travel alternatives with their own observed ownership, charge, quest, spellbook, and transport requirements."
    ],
    "unlock_transition": {
      "event": "player reaches an observed eligible Farming state, has the stated tools, retrieves one seed tier from the local table, and enters the farm",
      "deterministic_effects": [
        "the player may operate an isolated Tithe Farm session with the chosen eligible seed tier",
        "up to 10,000 local seeds of one chosen type may be taken for that session"
      ],
      "non_effects": [
        "does not confirm any planted crop, water dose, crop survival, harvested fruit, deposit, point, XP, shop purchase, collection-log entry, or future Grouping teleport eligibility"
      ]
    }
  },
  "activity_loop": {
    "entry_inputs": [
      {"item": "spade", "quantity": 1, "behavior": "reusable required tool for the Tithe patch loop; ownership and availability are observed"},
      {"item": "seed dibber", "quantity": 1, "behavior": "reusable planting tool unless the observed bare-handed-planting milestone supplies the alternative"},
      {"item": "watering can", "quantity": "one or more", "behavior": "reusable water container; three successful waterings per planted crop are needed before the respective growth stages. Dose count and refills are observed."},
      {"item": "Gricoller's can", "quantity": 1, "behavior": "optional permanent watering-can alternative. It holds 1,000 doses, equivalent to 333 complete three-water plant cycles before refill. It can be filled at water sources and, under the current update, for free through the Tithe Farm shop. Ownership and remaining doses are observed."},
      {"item": "Golovanova, Bologano, or Logavano seed", "quantity": "up to 10,000 local seeds of one selected type", "behavior": "taken from the local table after the relevant current or boosted Farming gate. They are session inputs, not an inferred bank item or external seed stock."}
    ],
    "reusable_setup": [